,Comment Author,Comment Body
1088,,I've seen the full conversation. And the full conversation doesn't reflect well on the male person featured here either.
1089,jacksawyer75,I think he is sad that he hasn’t been “used for breeding” and never will.
1090,,"Yikes, this is so handmaid's tail. Frightening levels of hatred dripping form each word.

Edit: Handmaid's Tale!"
1091,throwaway_escape,please report this if you haven't already.
1092,Rude_Entry,"With the title I meant that a woman got sent this. And yes, that is a man. In the other screenshots shared he even showed a dick pic. Because of course. 🙄"
1093,girl_undone,The male socialization jumped out.
1094,gogetgamer,"of course, because dick pics are virtual sexual assault and he knows it"
1095,girl_undone,Sorry to be annoying but 'tale' not 'tail'. The Handmaid's Tail would be a very different story.
1096,Rude_Entry,From what I've read the person who got this message already reported him. But as I don't personally know her I can't say if anything has come of it.
1097,ArtGal94,Post the whole thing!
1098,,Hahaha true!
1099,Rude_Entry,"I don't like reposting, if you're interested in seeing them I could just DM you the Twitter thread if you want"
1100,ArtGal94,Yes please let’s have a look!
1101,gogetgamer,you have ~~mail/male/~~a message
1102,AutoModerator,"Welcome to r/terfisaslur. 

What is a ""TERF""? While ""TERF"" is supposed to stand for ""Trans Exclusionary Radical Feminist,"" the people called ""TERF"" generally are neither radical feminists nor ""trans exclusionary,"" and in practice the term has become a slur. [More info.](https://redd.it/70cyzm)

We're documenting hateful rhetoric directed at lesbians, radical feminists, gender critical feminists, and others on Reddit and beyond.

If you're curious about why certain trans activists are clashing with some feminists, see [these resources](https://www.reddit.com/r/GenderCritical/wiki/resources#wiki_great_resources_for_people_new_to_gender_critical_feminism) from r/GenderCritical.


*I am a bot, and this action was performed automatically. Please [contact the moderators of this subreddit](/message/compose/?to=/r/terfisaslur) if you have any questions or concerns.*"
1103,,WHAT the ever LOVING fuck
1104,Skaddox,"It's SUPER gross that they even bring children into this weird, already gross and fucked up fantasy."
1105,tr330fsn4rk,"This is one of the worst I’ve seen... part of me wants to believe this couldn’t possibly be real, but the rest of me knows this isn’t even that far off from the “typical” anti-TERF bs. Thanks for the NSFW blur, OP."
1106,jetpatch,"TERFs are evil, also children are lifestyle accessories"
1107,La-Bete-Noire,"These always read like they found a “legitimate” cause to express hatred and violence toward women and can’t assuage how turned on it makes them. I have never in my life even heard of this level of viciousness toward anything but women. This level of high excitement at the idea of extreme, intimate torture makes them feel nothing less than orgasmic... because now is it not only socially tolerated, it’s actively encouraged.

They consider it the same thing as simply calling out Nazis, but 1) I’ve never seen T*RFS advocate genocide, just insist that the biological reality of binary sex exists 2) I’ve seen extremely violent TRA protesters holding barbed wire bats, holding up female dolls hanging from nooses, making shoddy, homemade guillotines... in groups they give off this threatening vibe that they revel in because all of it is considered socially acceptable."
1108,TheSaint7,I for one am getting tired of the rape threats
1109,Throwaway4638574,The optimist in me wants to believe this is a troll but the realist in me knows they say things like this all the time
1110,terf_fret,This is silence of the lambs level shit
1111,sirmooseking,"If these sick fucks aren't on a watchlist, then **what the fuck??** Is it now transphobic to keep notes of sadistic behaviours and threats which can easily turn from fantasy to reality?"
1112,2or3thingsIknow,Transcels be transcelling.
1113,baconbitsy,Wow.  They really are so sensible and kind toward our LiTerAl vIoLencE /s.
1114,WeaboosRus,"Ok comments like these actually scare the f out of me, like who is just sitting around being so insane about not being validated."
1115,mercybenelli,"Okay, Ariel Castro. Calm the fuck down"
1116,TheCatsEyeNebula,"But we are the violent ones, of course. :)"
1117,UnableAntelope3,Males gonna male
1118,mypretties,r/thisneverhappens
1119,californiacandy,the y chromosome jumped out
1120,Blondejobs,"Unblock the name, I just wanna talk."
1121,GeorgiaMRomero,"The violent threats are exacerbating. If there is not a groundswell of pushback, this shit will continue.

Why are they allowed to make these threats? They are disgusting."
1122,hedaleksa,"Yep that sounds like someone with a female brain because that’s how women speak/think about other women for sure /s

These men think they can put their shitty self in a new shell and we won’t notice they’re exactly the same person"
1123,GiveMeMedals,"Jeez, talk about bad publicity."
1124,WikiMB,Excuse me what the fuck?
1125,ginisninja,"NSFL (Not Safe For Life)

Can you imagine a woman insisting that she would rape a pregnant woman tied to a bed, covered in her own urine and faeces? I hope this was reported."
1126,watpompyelah,Yikes
1127,tamingthemind,yes this seems like a viewpoint worth listening to
1128,Throwaway3636838462,Right? This is sickening.
1129,mypretties,"Every single one of their fantasies involve children. TRAs are absolutely obsessed with children, transing them, getting access to their bathrooms, separating them from their parents, detaching them legally from their guardians etc"
1130,Throwaway3636838462,Agreed.
1131,arnaq,Pedophile. “Loving” family... but not that kind of love...
1132,Throwaway3636838462,"Yeah I realised no one should be forced to look at this monstrosity, and I feel like I should have put a TW in the warning for good measure but it’s too late now."
1133,Throwaway3636838462,Aren’t we all?
1134,ginisninja,"While this one is particularly egregious, they are so widespread against any woman (even conservative ones) who have the temerity to participate in the public arena. Yet men are rarely threatened with rape for expressing their opinions."
1135,GCnewb,Yeah this actually scares me too.
1136,smh_cheeze,i laughed too hard at this fuuuuuuuck
1137,angrytardis,Check https://www.reddit.com/r/ShadowBanned/
1138,theblackfleet,It's all projection and pedophilia.
1139,tr330fsn4rk,"You blurred it and we know the shit that usually doesn’t even get blurred on the sub, so I think you did enough."
1140,UnableAntelope3,Huh why
1141,Throwaway3636838462,"Thanks, I just don’t want anyone to be unecessarily reminded of trauma. As a victim of sexual assault this one really gives me the heebie jeebies, so I assumed others might have the same reaction."
1142,girl_undone,"We can't help, you need to talk to the admins or follow instructions you find somewhere."
1143,tr330fsn4rk,"Definitely gave me the heebie newbies, but I felt well warned. Thanks for sharing even tho it’s sooooo incredibly fucked. Where’d you see this? Like what site?"
1144,UnableAntelope3,I mean why would I check it out
1145,Throwaway3636838462,"It’s a screenshot of tumblr that I found on IG, I follow lots of gc/radfem accounts on there. If you want the specific acc then I can tell you over DM, I’m not sure if we’re allowed to post that publicly on here."
1146,girl_undone,"Because you're shadowbanned. All your comments are automatically deleted by the Reddit system, across all subs. They end up in moderation queue for approval, but if you want to use Reddit you need to fix it by following whatever directions are necessary."
1147,tr330fsn4rk,"Yeah, I would appreciate that. I’m always looking for radfems on Insta."
1148,Throwaway3636838462,Done
1149,AutoModerator,"Welcome to r/terfisaslur. 

What is a ""TERF""? While ""TERF"" is supposed to stand for ""Trans Exclusionary Radical Feminist,"" the people called ""TERF"" generally are neither radical feminists nor ""trans exclusionary,"" and in practice the term has become a slur. [More info.](https://redd.it/70cyzm)

We're documenting hateful rhetoric directed at lesbians, radical feminists, gender critical feminists, and others on Reddit and beyond.

If you're curious about why certain trans activists are clashing with some feminists, see [these resources](https://www.reddit.com/r/GenderCritical/wiki/resources#wiki_great_resources_for_people_new_to_gender_critical_feminism) from r/GenderCritical.


*I am a bot, and this action was performed automatically. Please [contact the moderators of this subreddit](/message/compose/?to=/r/terfisaslur) if you have any questions or concerns.*"
1150,Butchie68,"I love her even more now. Anyone ever notice these dudes talk about their dicks more than straight, normal men?"
1151,,Funny how transgenders dont get dysphoric about their dicks when they're using them for sexual violence
1152,jalapenopancakes,"I have been smiling like a moron ever since I found out she tweeted this today. 

Bless her. Looking forward to the influx of new friends at GC due to her."
1153,Lesbian_Frylock,That behavior you exhibited was male like. The male socialization jumped out.
1154,quasarbar,"Calling Ms. Rowling ""ugly hearted"" -- oh, the irony."
1155,LesbianPrincess-,Wowwwwww. Just when you think you’ve seen the worst of it.
1156,GypsyDanger_1013,For being totally-100%-biologically-valid-and-more-women-than-cis-women WOMEN they sure do like talking about getting their dicks sucked 🙄
1157,albatrosssssss,"why are trans ""women"" always so violent"
1158,GeorgiaMRomero,The trans lobby is simply vile.
1159,griffxx,"They can grow breast with synthetic HRT. Get their faces pulled down to chin to try to feminize their Male facial structure with a medical bone sander. Laser all the hair on their torsos.

But they will remain biological MALES. The death threats with their weaponized COCKS just absolutely shows they are just MEN who feminized their bodies.

The goto position is still sexual Violence against women."
1160,LizardsAndLimes,cant believe i thought these were the ppl i wanted to support once
1161,Tangleofsnakes,"Aww, it's this type of stuff that first brought me to peak trans. Memories!"
1162,,Are we surprised? Was never a fan of Rowling but I am now.
1163,DrCathyGale,"Who wants to bet that the guy who made the first tweet will never forgive JK Rowling for acknowledging biological reality, but will immediately come to Sorn's defense for her insensitivity towards black people?"
1164,NoStreaks,I noticed that many of these vile comments are gone from under JK's tweet. Have you saved more of them? Or know of a place where I'd find them?
1165,BlopYeet07,this person seems to have a crush on J.K. smh
1166,,"I've been reading trans subs for a little while today to laugh at this blowup, and something I've noticed is that if you click on the username of a mtf trans person, you have about a 25% chance of seeing that they've posted pictures of their dicks on Reddit in some sort of perverse sub."
1167,Poorfck,Proof that you can’t identify out of the oppressor class.
1168,girl_undone,No slurs.
1169,hamatehllama,"This recent scientific article explains the current knowledge of gender dysphoria*. GD is a minor brain abnormality that changes the self identity and anxiety while most of the brain is like usual for the natal sex. Thus it's not surprising that it's the MTF population that are causing most of the problems while we hardly hear anything from the FTM population despite the fast growth caused by the ROGD epidemic. 

The paraphilic/AGP subpopulation of male GD is likely the most common offender because of their abnormal sexual drive. We've seen this with JY and other famous cases where multiple paraphilias overlap within the same individual. It's sad to see it has become taboo to talk about abnormal sexualities. Sexuality is by no means an area devoid of pathological behaviours. On the contrary, the intense sexual urge (especially for men) can cause a wide range of pathological/perverse/paraphilic behaviours. 
 https://www.sciencedaily.com/releases/2019/12/191202135655.htm"
1170,lililychan,id rather not bet that. seems unlikely.
1171,exh_ust_d,The male bullshit is exhausting
1172,,Edited
1173,griffxx,"You mean like the young lady who ignored being catcalled. Was followed by said catcaller. As she opened the car door, he blitzed attacked her, raped her and then choked her out. Left her there in that position, as he walked away.

https://www.cbsnews.com/video/man-accused-of-killing-chicago-college-student-after-she-ignored-his-catcalls/
Man accused of killing Chicago college student after she ...

Thanks for the info."
1174,girl_undone,Thanks!
1175,AutoModerator,"Welcome to r/terfisaslur. 

What is a ""TERF""? While ""TERF"" is supposed to stand for ""Trans Exclusionary Radical Feminist,"" the people called ""TERF"" generally are neither radical feminists nor ""trans exclusionary,"" and in practice the term has become a slur. [More info.](https://redd.it/70cyzm)

We're documenting hateful rhetoric directed at lesbians, radical feminists, gender critical feminists, and others on Reddit and beyond.

If you're curious about why certain trans activists are clashing with some feminists, see [these resources](https://www.reddit.com/r/GenderCritical/wiki/resources#wiki_great_resources_for_people_new_to_gender_critical_feminism) from r/GenderCritical.


*I am a bot, and this action was performed automatically. Please [contact the moderators of this subreddit](/message/compose/?to=/r/terfisaslur) if you have any questions or concerns.*"
1176,eos-amavi,"Because that's what I do as an evil terf - I brigade and tell people who don't align with my beliefs to kill themselves and brag about it in a circlejerk with my friends who don't have the sense to tell me not to be childish

Oh wait..."
1177,Tweeders55,So the guy in the photo is her trans self portrait I take it.
1178,naiiad-bee,lmao “*says dumb bullshit* TRANS RIGHTS !!! ✊🏽“ how embarrassing and infantile jesus. self awareness is truly at zero if they dont realize how stupid that looks.
1179,ArtGal94,"also belongs on /r/cringetopia 

fuckin dweeb"
1180,Seasmoke_LV,"So trans rights is to wish women to death. 

Ok, noted."
1181,moglbu,“TERFs are gross” lmao is she 14?
1182,WikiMB,"So brave, mature and stunning /s"
1183,alexis21893,"Supporting trans rights would be convincing us that we're wrong, not making us more certain of our position"
1184,doritoschilli,"Lol these people are so immature. Real activists put their points across like adults, not with this childish bullshit."
1185,930ygs,The internalized misogyny this girl probably has is heartbreaking
1186,faultierin,"I wonder what these people do all days, if they have so much time for such bullshit."
1187,hamiltonHexx,I'm predicting there will be more posts like that with most schools being closed because of the Covid-19 pandemic. All these edgy teens with nothing better to do with their time than brigade subs they don't like then go running back to their fetish subs looking for head pats and validation from the hivemind.
1188,DistantGlimmer,I guess it makes sense since she thinks she's a man and trans rights are men's rights.
1189,Simone_Auclert,Dang she really be cravin' that male approval.
1190,Literal_Violins,"Wow she's so brave and masculine! Sitting on her arse trolling women online. Yeah, I'm sure all the greatest revolutionaries liberated the oppressed that same way. And of course the TiMs will love and respect her as A Real Man, now. They'll be ever so appreciative of her gallant, manly efforts, tapping away on a keyboard to guard the collective honour of their Lady-Genders. /s"
1191,TittiesVonTease,"Just imagine the backlash if we did what they do. If we went into their subs saying ""kill them all"". 
Can't they not see how fucked up doing that is?"
1192,,[removed]
1193,,[removed]
1194,daughter_of_bilitis,"Exactly. There was one person in the meme comments who checked her posts and was like, ""you told people to go die, that's not good"" and they got downvoted lol"
1195,Pansexual_PANcake079,"A lot of people that call them self a terf to that to men, like they are still oppressed, no men are oppressed now"
1196,Tweeders55,Also I was informed by lgb drop the T is actually run by trans people.
1197,daughter_of_bilitis,"True. She really thinks this makes her some hero 😂 

The funniest part to me is that she was complaining about how ""rude"" everyone replying to her was....after she posted threats of death, told people to kill themselves, and said people should fuck off. Truly a big brain moment."
1198,marcheridan,"As an actual 14 year old, I can assure you that calling people simply gross without stating why, or at least trying to be mature, is on a 9 year old's level."
1199,daughter_of_bilitis,"Exactly. Imagine if gay rights activists or civil rights activists had just told people to kill themselves instead of actual activism, lmao."
1200,daughter_of_bilitis,"Nothing important, not in the least because 75% of them are actual children."
1201,daughter_of_bilitis,"Lmao, adorable. Someone's projecting realllllllly hard.

I'll fight for women's rights until my dying day. The right of female assembly, to have our own spaces, to have restrooms we feel safe in, to talk about our biology and our problems, and to define our own community. And you know one thing I know about feminism? It's never been popular. The cool, not-like-other-girls have never been feminists. But feminists always win in the end. 😊"
1202,Tweeders55,Not hard. It's per usual.
1203,daughter_of_bilitis,"""who you don't believe should be allowed to exist""

Lmao be more dramatic. Educate yourself on radical feminism next time before you embarrass yourself.

Bonus points for your casual appropriation of anti semitism."
1204,denverkris,"yes, it's ok to tell us to go die, and all the while we're ""LitErAllY kILLinG THeM"" with our words."
1205,,[removed]
1206,daughter_of_bilitis,"People on the sub were celebrating her saying ""KILL ALL TERFS"" and ""GO DIE"" but if I say ""you're born a female and will die a female"" I'm violent and dangerous LMAO"
1207,daughter_of_bilitis,"You're right. It's not comparable. Mainly because there's literally no evidence that trans people face any disproportionate level of violence. Actually, being trans drops the chances of violence against you compared to the non-trans population. Look at the numbers yourself. 

https://medium.com/@sue.donym1984/the-transgender-movement-and-bad-stats-a-debunking-compilation-31760947b382

https://medium.com/athena-talks/trans-murder-rates-the-data-120b60b19cb4

You can be as angsty as you want. Feminists still exist and we aren't gonna shut up just because your activists threaten our lives, dox us, and cancel us."
1208,goneharolding,"Yes, this is amazing - the clearest documented wild case of DARVO I have ever seen. Caught in the act, game over.
You don’t have any screengrabs of the comments, do you? 🙏"
1209,daughter_of_bilitis,"I do! Tho uploading them to imgur will take a bit

Edit: comments from the meme post: 

http://imgur.com/a/eAUaxTd

One of the commenters even admits to going through her comments and upvoting the abuse, so it's not even like ""they didn't know"" she was just telling people to die/threatening to kill them."
1210,goneharolding,"It’s.... so beautiful 😱
I want to write an article about it, how it is a perfectly distilled example of what we have been talking about all along 
And why, especially now with the world in a tailspin, we can’t afford to give an inch to these assholes.
If it would be simpler to email them I can dm you an address. I look forward to giving it the treatment it deserves."
1211,another_nonymous,">nah, you sacrificed your mental well-being


Jeeeeeeesus Christ these people are wingnuts"
1212,daughter_of_bilitis,"I know, right? ""You sacrificed your mental health...by completely unnecessarily attacking people who weren't bothering you in their own spaces. A hero!"" Lmao."
1213,,"The more rich celebrities that tweet the word ""TERF"" is just thousands more normal people googling it and understanding what it means. 


Call us ""shit"" you rich unaffected white man.  You’re just helping us out."
1214,RadFriends,I can’t imagine being a middle-aged man unironically saying TERF
1215,quasarbar,Pity he doesn't have the sense to bust the myth that men can be women.  It wouldn't be hard.
1216,ThisIsLifeJim,"Does no one possess even an ounce of critical thought any more?


It’s so simple to see the TRA agenda, so my conclusion is that people are either stupid or they hate women. Which one is Adam Savage do you think?"
1217,Balmorran,"https://i.imgur.com/OUVF20m.jpg

It will never be enough."
1218,angrytardis,"TIL LGB people are ""terfs""..."
1219,devgril,Ironic the guy from myth busters believes in the transcult. More like a myth believer.
1220,simpleflavors1,There's a reason Jamie doesn't like him...
1221,2or3thingsIknow,"Yeah, because women\\terfs are so powerful we can ""peel"" away the trans. These people are legit fucked. The most nasty vile misogynists I have ever encountered. They have all the power. Obviously. Nothing says power like the ability to silence, ban and censor any criticism. To change the very definition of an entire class of people against their will. Yeah, poor fucking psychotic trans bastards. So oppressed."
1222,sojourner_truth_,"That's so sad. I used to like that show, until it became ""let's ogle the skinny redheaded girl"" show. Now I see this. Disgusting."
1223,queendead2march19,r/lgbdropthet
1224,stephanonymous,"The thing is, most people who are on the anti-terf train right now don’t even really understand the beliefs that are actually held by the people that get that label.

Do you think people should be free to say “I don’t want to sleep with someone who has a penis/vagina”? Congratulations, you’re a terf. I have a hunch that many many people don’t even realize they would get labeled terfs as well if they had to have their views actually put to the test. But straight white men are not the targets and never will be."
1225,Deleteordecay,As if we care what rich white men think.
1226,t3rribleTammy,Wow. I’d nerd out over Mythbusters and the stuff he has on his YouTube channel. What a let down.
1227,,Another woke beard
1228,NYCradfem,What a jagoff.
1229,jurziyn,"I’ve been seeing more and more people tweet things similar to this recently, yet they rarely if ever tweet something about racists or sexists."
1230,MadSeaPhoenix,Pathetic.
1231,rxqueen85,I hesitated to post before but this post was so fucking dumb for so many ridiculous reasons not to mention the conflating conservatism with being a so-called TERF. PHEW. I can’t breathe.
1232,SpaceInJourney,"The 'T' should be dropped tho, Gender identity =/= sexuality"
1233,ESyzygy,"Actually the only reason I sorta support that is because gender and sexuality are two completely different things. Not because I’m “transphobic”. I just hate the people who call me a terf for talking about the fact that I AM FUCKING LESBIAN. Those people can be whatever race, whatever sexuality. Idc."
1234,,[removed]
1235,HellyOHaint,I've never heard of anybody saying LGB. I call bullshit. So called TERFS are almost never against transgender people. Strawman!
1236,QueenRowana,Yeah i used to think he was awesome. But now i just think he’s sad for joining with other men to trample on women. The mythbusters glory days are already long gone but he did do some awesome episodes back in the day. Lets hope Jamie stays normal.
1237,nikitatx,"Exactly. I’d personally like to thank Contrapoints for the Gender Critical video. The content didn’t sit well with me, and I finally took some initiative to understand what a TERF _actually_ is, and that is the sole reason I ended up on the GC sub. Thanks for helping me reach peak trans Contrapoints, and finding my gender critical tribe."
1238,MonoRubric,If he did he would have angry trans deplatform him for wrongthink
1239,,"I honestly think it’s just people *trying* to be good people but just lacking understanding. 

I think the vast majority are people who are still a couple steps behind trans rhetoric, people who think trans people are just gay men living with crippling dysphoria and just trying to get on with life. 

I think another large chunk are people who ""don’t understand it"" and think that because it doesn’t make sense to them it must be intellectually above their heads and therefore super smart and enlightened and deferring to the loudest people is correct and deferring to the ""marginalized"" is woke and a harmless (to them) and easy way to ""be a good person"". To them bigots reject what they don’t understand so the logic must be that good people accept what they don’t understand"
1240,QueenRowana,I hope it’s the first because i used to love mythbusters. But because of that i also think he probably isnt stupid. So i guess that leaves ‘hate women’ sadly
1241,cursorylight,"Holy fuck. What exactly do they want? All their allies are ""no doubt"" secretly ""TERF""s? If you say you support them they'll always think you're lying until you post a sex tape of you fucking a trans person?

No other group of people lives with such an insanely high level of paranoia at all times."
1242,,They say transition isn’t a fetish and it isnt sexually motivated  yet having sex with them is the only real way prove yourself an ally 🤔
1243,quasarbar,"Well, they have a point.  If he thinks TIMs are women, why shouldn't he be every bit as willing to date and fuck them as natal women?"
1244,QueenRowana,Christ. Even being an ally isnt enough anymore. Oh well
