,Comment Author,Comment Body
431,jacksawyer75,Ah.  There is nothing more feminine than telling someone to suck your dick. (Eyes roll)
432,sadxtortion,Uh yeah no one forgets actual women run it. Men ru(i)n enough shit and btw if you have a penis you’re not a woman sorry not sorry
433,Mother-of-Rats,He looks like Quagmire from Family Guy.  What a chin! He also seems to have the same attitude towards women.
434,TheCatsEyeNebula,Very ladylike.
435,cnemidophorus,He looks exactly like Kuzco from The Emperors New Groove.
436,,"Yeah. We haven't forgotten, dude."
437,millenially_ill,Lookin like Cameron Frye...
438,griffxx,"Desperately trying to stake a claim to something that has nothing to do with people born MALE.

Claim only what the Trans community created."
439,Nibbana0,"Yes we know men run everything, into the ground, which is why we don't want them running our biology."
440,MaxinistaFemmeinista,"When Men’s Rights Movements fail, become a “woman” to get your shiny star."
441,dulingo_monster,It's sad seeing men wanting to participate in something they don't belong to
442,Tsuki_17,I don’t see any man in this picture. Where is he?
443,TribalRevolt,we warned you the slippery slope is real
444,,[removed]
445,watpompyelah,For real
446,,[removed]
447,watpompyelah,So ladylike!!
448,griffxx,Water is wet.
449,,[removed]
450,ThrowRA_12,The one with the 5 o'clock shadow telling people to suck his dick
451,hedaleksa,I never said I was a victim I said it’s toxic for men to think they “run this shit” it’s laughable and cringey for any man to be that deluded. Just because real women say or do something doesn’t mean these men doing it is the same thing.
452,ciaokhan,"Well real women have problems with that.

Listen dont demand"
453,ndkaldjen,"He 100% doesn’t. Well, maybe if he’s 30 feet away and the observer is extremely myopic lol."
454,,[removed]
455,ciaokhan,"Mind rewording that, I don't understand :/?"
456,,[removed]
457,ciaokhan,"Thank you, 

That aside. As someone born female, understanding the shit that comes with being born female. Why do you think it's acceptable for somebody who was born male and lived the majority of his life male to feel the need to be represented in stuff like this?

They of course deal with their own form of prejudice and discrimination. But it's absolutely not the same."
458,,[removed]
459,ciaokhan,"But they've never faced sexual and discriminatory prejudice for being born a woman, and that's the whole point of the march.

It's like if I decided to identify as another ethnicity and automatically become representation for their struggles because I want to feel included. It's derogatory and offensive. I can 100% understand why women are pissed"
460,,[removed]
461,AutoModerator,"Welcome to r/terfisaslur. 

What is a ""TERF""? While ""TERF"" is supposed to stand for ""Trans Exclusionary Radical Feminist,"" the people called ""TERF"" generally are neither radical feminists nor ""trans exclusionary,"" and in practice the term has become a slur. [More info.](https://redd.it/70cyzm)

We're documenting hateful rhetoric directed at lesbians, radical feminists, gender critical feminists, and others on Reddit and beyond.

If you're curious about why certain trans activists are clashing with some feminists, see [these resources](https://www.reddit.com/r/GenderCritical/wiki/resources#wiki_great_resources_for_people_new_to_gender_critical_feminism) from r/GenderCritical.


*I am a bot, and this action was performed automatically. Please [contact the moderators of this subreddit](/message/compose/?to=/r/terfisaslur) if you have any questions or concerns.*"
462,crispycherrypie,"Oh, look, we can add anti-semitism to the list of things TRAs think they can get away with because we don’t believe males can be women."
463,Simone_Auclert,This is such a disgustingly vile and cruel thing to say. I have no words...
464,palanuik,"Uh-uh, nope. That's about 6 million steps too far for me.




ALSO: remind me again how TERFs are just like racists in innumerable facile ways....wait no, that table juuuust turned on you I think, Sir."
465,catsbatsallthat,"So did all the worst men decide to start wearing lipstick and fake having periods? Why is this allowed in a social climate? How can anyone be okay with this and even cheer their misogyny? 

I feel like all the dipshits, from the donald, who couldn't ""get"" a woman decided to become one and now their atrocious grody behavior is being rewarded.

I'm mad and I've had alot of special eggnog so forgive the incoherent rant."
466,trichick22,Wouldn't expect anything less
467,Lesbian_Frylock,"But sure, WE'RE the Nazis"
468,quasarbar,"Wow, that's so woke."
469,BellFirestone,"Seriously, WHAT THE FUCK?!"
470,miavim,Disgusting. Not at all surprised
471,DimDroog,Disgusting.
472,Sunday_V,"Holy shit, I didn’t realise I could be any more disgusted. This is utterly horrific."
473,Glamalez,I wonder what hitler would have done to trans people?
474,MalaLija,"I am kinda new here, and needless to say that I am appalled, but I guess I shouldn't be surprised because they can use any ideological standpoint agains GC feminists yet everything is allowed. but I'm curious, why cover the name? everyone should be held responsible for what they say."
475,,Ood
476,Tangleofsnakes,*THE RIGHT SIDE OF HISTORY!!!*
477,Consider_the_Horses,No surprise here. There's a large overlap between 4chan and the transgender community.
478,yikes3636,"So you're saying all trans people hate jews? That's funny. Because multiple terfs have killed trans women but here we are. Using small examples of bad people to reflect entire communities is unhealthy and not progressive. im trans and I am Jewish.  I would never say ANYTHING REMOTELY like this to anyone.

let's agree to disagree."
479,yikes3636,"If terf isn't a slur, what do you want us to call you?"
480,YesPleaseMadam,Why not. A huge part of the left has been getting away with antisemitism for quite a while.
481,leethevaultdweller,"""6 million"" 

You sneaky commenter ;)"
482,SqueakyBall,Single worst thing I've ever seen :(
483,womenopausal,[A bit of cross-dressing was just good fun in Nazi Germany](https://nationalpost.com/news/cross-dressing-nazis-a-german-artist-found-so-many-photos-of-them-he-published-a-book-about-it).
484,2or3thingsIknow,"Huge cross dressing fetish among Nazis. Already posted. Sorry

&#x200B;

[https://nationalpost.com/news/cross-dressing-nazis-a-german-artist-found-so-many-photos-of-them-he-published-a-book-about-it](https://nationalpost.com/news/cross-dressing-nazis-a-german-artist-found-so-many-photos-of-them-he-published-a-book-about-it)"
485,Wreough,"Strawman argument yawn. Quit lying, especially about murder. It’s such an ugly thing to lie about for manipulation. But it’s what you resort to because you have nothing of substance to say. Get some reading comprehension and read up on logical fallacies too before you make a fool of yourself next time."
486,radfemalewoman,Yup. I’m Jewish and I have felt like a woman with no country for a long time. Both sides hate me.
487,palanuik,Excuse me?
488,Tweeders55,I will have to check that one out. Pretty interesting. Thanks.
489,Glamalez,Wow... yeah that’s all I got...
490,winewatcher,"Nazis cross-dressed but Hitler had homosexual men and drag queens arrested, sent to camps, and murdered. They were forced to wear pink triangles to distinguish them from Jews (yellow stars, communists (red something), etc."
491,yikes3636,You know how much good stuff our community has done while you're just sitting and making people feel terrible?
492,yikes3636,"Also, are you saying I would murder someone? because of my *gender*? and i'm the bad person???"
493,yesisaiditxx,The person thought you meant to allude to the estimated 6 million Jews murdered in the Holocaust.
494,,[removed]
495,palanuik,"Yes, I did mean to do that. 
But my antisemitism radar is pretty sensitive so that comment has me on the defensive."
496,palanuik,"Yep, and checking their history it was a nice friendly dogwhistle to their fellow antisemites."
497,LesbianPrincess-,Right... wasn’t it 8 million instead?
498,,[removed]
499,yesisaiditxx,Yeah after I commented I figured it would have been too ironic not to be intended. So that reply to you takes another turn now.
500,leethevaultdweller,"ok so.. I'm just now seeing this, but how is my post history antisemitic?

edit: you mean the Nazi meme? lmfao"
501,yesisaiditxx,It’s 6 million Jews but 11 million total if you count everyone killed.
502,avicioustradition,"You'll never be a man. Until the day you die and forever afterward you'll be a woman with short hair, an intentional chemical imbalance and depending on your personal decisions extensive plastic surgery and body modifications. You're not a man. You can scream it as loudly as you like, but it won't make reality any different. You don't want to be a woman, I get that. I can't blame you. The world can be kinda shitty for us. However, you can't just opt-out of reality. I can say I’m a walrus --but if I show up on a beach none of the other walruses are going to be particularly impressed me and zero percent of them will buy it. As for the rest of what I wrote, the concept remains the same so I don't see a point in editing it. 

( Correction: in order to not feed into delusional thinking I did indeed edit pronouns in my previous comment in order to reflect reality.) 

You understood it clearly enough. You don't have to be a girly girl, you can have short hair, you can have your breasts removed--you can take hormones if you want because its your body and you can do what you want with it --but how you express your personal aesthetics has exactly zero impact on biological fact.  You're still a woman and the rest of the world has no obligation to play along with your fantasy. You need to accept who you actually are, a non conformist  woman, instead of making up a whole new person to distance yourself from the things you dislike about the world and your body."
503,LesbianPrincess-,Oh :( Either way it’s appalling.
504,AutoModerator,"Welcome to r/terfisaslur. 

What is a ""TERF""? While ""TERF"" is supposed to stand for ""Trans Exclusionary Radical Feminist,"" the people called ""TERF"" generally are neither radical feminists nor ""trans exclusionary,"" and in practice the term has become a slur. [More info.](https://redd.it/70cyzm)

We're documenting hateful rhetoric directed at lesbians, radical feminists, gender critical feminists, and others on Reddit and beyond.

If you're curious about why certain trans activists are clashing with some feminists, see [these resources](https://www.reddit.com/r/GenderCritical/wiki/resources#wiki_great_resources_for_people_new_to_gender_critical_feminism) from r/GenderCritical.


*I am a bot, and this action was performed automatically. Please [contact the moderators of this subreddit](/message/compose/?to=/r/terfisaslur) if you have any questions or concerns.*"
505,2or3thingsIknow,These men are dangerous and they really should be considered terrorists.
506,griffxx,"There is a high probability this kind of violence could happen. I feel we are coming to a pivot point. I think the JK Rowling tweet really got people to recognize what's being said by these Feminized Men and the biological incoherence that is the foundation of the Movement.

It also doesn't hurt to have 14 million followers on Twitter, watch as her feed blow-ups with rape and death threats, and the ubiquitous pointing gun gifs.

I feel very pleased about it the magnitude of the exposure to Trans nonsense."
507,BoobDoodles,"But, I thought it was us “TERFs” threatening literal violence and wanting trans people dead? 🤔"
508,quasarbar,And yet we're the ones guilty of literal violence for calling males males.
509,veachh,Context pls?
510,devgril,"CARRY. A. GUN. 

She has enough proof that her life is at risk to go and apply for a concealed carry permit."
511,antidensity,Jesus. I hope she stays safe.
512,NoStreaks,It's definitely getting.. interesting. I just really hope no one dies.
513,Detroitaa,"Yep. A lot of people read her perfectly reasonable innocuous tweet, and were shocked at the hateful vitriol it unleashed. Gender critical folks have become used to the rape threats & people posing menacingly with baseball bats & such. But, ordinary people were shocked."
514,,I assume she's speaking at the Seattle Library thing with WOLF.
515,LowCalPal,That's not a thing in Canada except for law enforcement
516,TheSaint7,Unfortunately not every country gives you the right to defend yourself from a rapist/murderer
517,griffxx,There will always be some unhinged people connected to any Civil Rights Movement. For example one of ours was Valerie Solanas who wrote the S.C.U.M. and ended up shooting Andy Warhol in the late 60s.
518,griffxx,"As the Simpsons' Mr. Buns says:.""EXCELLENT"""
519,tr330fsn4rk,"Man, I wish I could go to Seattle."
520,devgril,"I just read that if you have a good enough reason such as carrying large sums of money, or reasonable suspicion of imminent harm or death they govt with grant you a concealed carry permit, Section 20 of the Firearms Act allows issuance of an Authorization to Carry (ATC) in limited circumstances."
521,Rubyrgranger,I read this in his voice 😂
522,griffxx,😁
523,AutoModerator,"Welcome to r/terfisaslur. 

What is a ""TERF""? While ""TERF"" is supposed to stand for ""Trans Exclusionary Radical Feminist,"" the people called ""TERF"" generally are neither radical feminists nor ""trans exclusionary,"" and in practice the term has become a slur. [More info.](https://redd.it/70cyzm)

We're documenting hateful rhetoric directed at lesbians, radical feminists, gender critical feminists, and others on Reddit and beyond.

If you're curious about why certain trans activists are clashing with some feminists, see [these resources](https://www.reddit.com/r/GenderCritical/wiki/resources#wiki_great_resources_for_people_new_to_gender_critical_feminism) from r/GenderCritical.


*I am a bot, and this action was performed automatically. Please [contact the moderators of this subreddit](/message/compose/?to=/r/terfisaslur) if you have any questions or concerns.*"
524,boogieunicorn,Telling women to shut up. Very progressive. Very brave. This totally wasn't posted from 1955.
525,TinyCatSkeleton,"I’m, how am I supposed to cHokE oN gIrlDiCk with my mouth glued shut? Checkmate, transbros?"
526,Tangleofsnakes,Cool time warp trick: replace terf with suffragette and you have a political cartoon from 100 years ago!
527,life-as-a-bug,Silencing women. How manly...
528,Mege-Voignamir,"Tell me more about how ""make up"" isn't a multinational profit scheme."
529,,[removed]
530,UniverseCity17,"I think you mean transgals; transbros are the ones that don’t have girldicks, ya see"
531,LesbianPrincess-,Bwahahahahaha
532,esena_,They aren't that's the whole point
533,boogieunicorn,Thats true! I am very sexist against men.
534,esena_,That's not something decent humans do either
535,AutoModerator,"Welcome to r/terfisaslur. 

What is a ""TERF""? While ""TERF"" is supposed to stand for ""Trans Exclusionary Radical Feminist,"" the people called ""TERF"" generally are neither radical feminists nor ""trans exclusionary,"" and in practice the term has become a slur. [More info.](https://redd.it/70cyzm)

We're documenting hateful rhetoric directed at lesbians, radical feminists, gender critical feminists, and others on Reddit and beyond.

If you're curious about why certain trans activists are clashing with some feminists, see [these resources](https://www.reddit.com/r/GenderCritical/wiki/resources#wiki_great_resources_for_people_new_to_gender_critical_feminism) from r/GenderCritical.


*I am a bot, and this action was performed automatically. Please [contact the moderators of this subreddit](/message/compose/?to=/r/terfisaslur) if you have any questions or concerns.*"
536,espresia,I never even interacted with them and they STILL banned me. Crazy
537,cbatta2025,The mods may be trans themselves.  It’s a sad state of affairs for sure.  Sorry you even had to interact with such douches.
538,tr330fsn4rk,"That sub is a joke. I’d never even visited the page and they banned me 🙄 Pretty sure that’s against Reddit rules, but whatever."
539,yesisaiditxx,"That’s why I made another reddit account to post in radfem communities because I knew I couldn’t comment on even a funny meme elsewhere without getting banned and attacked. 

Turns out, I enjoy this corner of reddit more than all the other increasingly ridiculous subs and now am hardly ever on my “actual” account. So, this is my actual account :) I’d take participating in these spaces over the rest if that’s how it has to be. 

I don’t mean any disrespect to her (the mod) but someone who obviously thinks sex work is a fine way to make money and continuously responds with condescension when someone confesses details of her rape? Dear, her ability to think outside the rules of the TRA cult is barely there, if at all. So many people on reddit get a thrill out of witch (pun heh) hunting “terfs”. You’d think maybe we could see this is the internet and allow for people to still post in your subs as long as what they post was appropriate...but we have long left the shores of reason. I’m glad you stood up for yourself, we all have to stay vocal."
540,illillillestt,"You need to ""work through your trauma"" but apparently the trauma that makes people trans is ~*~ VaLiD"
541,RoundTwoElectric,"From their rules:

“No Evangelizing

Posts & Comments

Witches are not meant to be saints. Users claiming a moral high ground may have their participation restricted”

Ummmmm"
542,Butchie68,Men in dresses are taking over everything like cockroaches.
543,noisyasamouse,"That sub has been completely taken over by TIMs and their worshipers. It's a pretty sad state of affairs. The concept has potential but a good portion of the posts and comments are pandering to men. 

Even with all of that, this is a shocking level of gaslighty scuminess. Even if someone believes ""trans women are women"", they are still in the same ""AMAB"" category as ""cis men"". But of course a traumatic response towards ""AMAB"" people isn't valid by their standards. In what universe is telling someone who isn't hurting anyone to ""manage your trauma like everyone else"" appropriate? There's something really insidious about this that I can't quite put my finger on, it's as if the mod feels entitled to your emotional state, as if the insides of your brain are obligated to be free of any thoughtcrimes against TIMs. This framing of trauma as something ""problematic"" that you basically need to get over for the benefit of others is absolutely vile."
544,Peakedalltohell,I would bet $20 that the person replying to you was a dude
545,mypretties,Most of the mods are TIMs
546,Ginger1383,Gross. I thought that was a radfem group. I'm going to unsubscribe.
547,,"Yes, i was called a TERF ( a term I had never heard before - had to google it)  because I participated in r/gendercritical 

At that stage I was discussing anti prostitution, and my attitude to TRA was liberal AF

Peaked me SO hard. Kicking ME out of a female
space on your whim. Ugh, they literally recruited me to become GC with their shit rationale and attitude. Failed to listen to any logic."
548,Cardoba,That subreddit is shite to begin with
549,Wiggy_Bop,"They booted me as well. I never once posted there, but apparently they stalked my subs, and found me not worthy. 🤨"
550,wanderingbubble,I'm sorry you went through this and had someone pursue you like that. That's really horrible and i don't understand why anyone would act like crybaby teenagers matter more than survivors of abuse. Good riddance to that sub
551,csemege,"I'm pretty sure the mod was jerking off reading your attempts to explain yourself.

Just disgusting."
552,kalijhin,Is it just an instant ban for anybody who participates in subs they don’t like? Hmm. So much for being against the patriarchy. Women being silenced again.
553,throwaway_escape,"reddit is saturated with men, even in the woman subs.  As moderators.   Colonization"
554,redlilitu,"Men have distorted all female-centric mythological symbols to decorate their necrophiliac religions. It's not surprising that they want to appropriate the words and symbolism of witches as well.   


We can't have anything female."
555,,"The moment you were banned you became the enemy. Nothing you could have said would have changed their mind, not even ass-kissing. You can tell by how fucking rude and insensitive the replies were. Not an ounce of sympathy. 

Better put up a headstone with ""witchesvspatriarchy"", cuz it's another one dead by the hands of men."
556,himecut,"JUST GET OVER YOUR TRAUMA, BRO

&#x200B;

fucks sake, this is so infuriating. these people are monsters who genuinely believe they're good people or ""on the right side of history"". what a fucking piece of shit"
557,crispycherrypie,"Dear witcheswholovepatriarchy, please ban me from your shitty sub, I’m an atheist, a radfem, and also I will report you to the admins for harassment.

Love, crispycherrypie"
558,jupiterssunday,Aren’t they peak libfem but in Wiccan flavour?
559,knight_siegmeyer,"I'm sorry about what happened. That 'just get over it' response was genuinely annoying to me. As someone who was also assaulted in a bathroom. 

Sometimes this 'you're a TERF nyah nyah' attitude really comes across as dumb meangirls-esque gatekeeping. Like they get some high horse satisfaction from it."
560,,"Yep, that sub is trans cult handmaiden land."
561,,So I guess we have to make a ActualWitchesVSPatriarchy sub then
562,mnem0syne,I got a ban (never commented there at all) saying “Bigots not welcome.” They’re a joke.
563,06549r,Sounds like a TIM. Typical how they try to control everything and everyone to keep their fantasy world.
564,archpope,"> Witches vs. Patriarchy will always stand for trans rights.

Patriarchy wins by forfeit."
565,alexthegeologist,"Anyone in for helping create a new witch based sub? 

r/RadWitches"
566,artificialgraymatter,WOPs.
567,bishhpls,"Remember, men's feelings always come over women's safety to libfems. Esp if the guys in a dress. 

It blows my mind how proclaimed feminists can somehow do the mental gymnastics required to rationalise elevating men who wish they were female above actual females. It's exactly like Orwell's 1984. The truth is lies, and lies are truth. Once enough people start proclaiming 2 plus 2 is five, others will follow. The social acceptance is too important to them. We are being socially engineered to believe bizarre and illogical concepts. 

These women who don't give a fuck they're walking back women's rights 120 years and who deride, mock and exclude women concerned for the status of our sex are absolute traitors."
568,bitchbaby1,this is so horrible. im so so sorry. 😥
569,GeorgiaMRomero,"I just got banned from news for asking why the “girls suing to block participation of transgender athletes“ was locked.

Then they called me a terf.

I am so concerned about the ongoing suppression of any thoughts that deviate from the party line.

Why is it ok to call people terfs? Is their “movement” a house of cards that they fear any information or perspective that differs, will collapse the trans lobby?

What other group of people are threatened and silenced in our society now? 

Why is it allowed?"
570,ESyzygy,"I almost said something like “JK Rowling is kinda right”

On a post that included this picture: https://i.redd.it/kjh1eqksdl541.png

But then I realized they would ban me so I didn’t.

Edit: that sounds kinda oppressive doesn’t it?"
571,politipoop,"Thank you, but no worries, I’m used to it :) and at least we know what the mods there are really like now. Don’t expect them to treat you like like a human."
572,Momma_Zerker,That sub is radical feminist horseshit. There's no logic or reason to it.
573,politipoop,"I have no idea what their criteria is for banning people. Do they not like lesbians? Are the mods actually homophobic? It seems so weird. Especially that mods for a “feminist” sub would try to shame and guilt me for not being able to shake off my trauma as easily as a sex worker.

Well, sorry for having been raped and abused and not healing fast enough from it, your majesty. Like wtf?!?"
574,Detroitaa,"They banned me, after I made my first comment. It had nothing to do with trans, or gender issues. I complemented someone for getting a new job. I was subsequently banned. When I asked why, they said I was a terf. They must have gone thru my comment history. I’m guessing one of the witches, was really a warlock🤷🏽‍♀️"
575,GeorgiaMRomero,"I was not even subscribed to them and got banned.

Truth is forbidden. 

Only trans doctrine allowed."
576,rbf4eva,Me too! Just sent me a message one day to say that I'm banned because I'm a terf.
577,politipoop,"Just insanity, I thought we were way past victim blaming now. Fine if they don’t agree with “lesbians are lesbians” (that would just mean they’re ignorant), but why be such dicks about it?"
578,politipoop,So many people here are saying this! They must have some sort of bot that checks all subs they deem to be unsavoury.
579,politipoop,"Thank you. Yes, it seems like they’re either properly brainwashed, or have absolutely no empathy whatsoever for women. I’m glad that reading it back they do come across as the irrational, cruel one, and not me :)"
580,politipoop,"Oh my, I didn’t pick up on that! So true."
581,politipoop,"Yeah, seems like they don’t understand their own rules. Or they’re so tone deaf that they really don’t see it"
