,Comment Author,Comment Body
826,GeorgiaMRomero,"Non-compliant women have always and will continue to be, a target for male hostility. Threats of violence are the TRA’s go-to behavior.

They were born male, raised in our sexist and patriarchal society and continue to behave as men.

It is so simple to see. 

If you are looking, that is."
827,girl_undone,Unhinged.
828,CorruptSoulGem,I like how they just assume you don’t know what a lobotomy is.
829,TheGreatWhoDeeny,">You should pick on men instead...

>This thread is full of men for you to harass and violently threaten

Great way to end that message. He's a coward, he knows it, and that's why he's not pulling this shit on any of the men. Too dangerous to go around threatening to doxx men or threaten to get them fired...he might stumble upon the wrong one."
830,Far-Air,"Yeah, it was almost too perfect. I'd think he was a troll (and maybe he is?) but he has history in mypartneristrans, so I don't know. If he's serious then I have no doubt he'd try to kill me in person. What a creeper."
831,Shredditorrr,"Ever since the early 20th century “progressive” has stopped meaning a good thing. There is no difference because there can’t be.

Only way to cope is more attention, posts like these are very important."
832,,[removed]
833,mermaidarmpithair,"Thank you for introducing  those subreddits for me.

My anger meter sometimes gets too high on this subreddit, but r/itsafetish is  mostly funny  with  the  meme  format,  so  I  got  to  stay  on  topic  while  keeping  the  rage  down.  I  can’t  thank  you  enough."
834,Far-Air,Thanks :)
835,DistantGlimmer,I legit get worried one of these unhinged moron narcissists  is going to do something awful to a woman. I'd like to think they're just trolling but I think the rage is quite real unfortunately.
836,mikerotunda,"Go dilate your wound, freak."
837,griffxx,Your welcome 😊😘😊😁😁!
838,griffxx,💗
839,jetpatch,Already happened. Google Dana Rivers.
840,Thatlikesomething,"They already DO commit atrocities towards women.

They stalk their sister's and wives and go through their personal belongings and fetishise those personal belongings I.E. stealing underwear, wearing underwear, masturbating in underwear. They coerce these family members in acts of enabling their behavior with threats of suicide. 

They attack women on panels that speak about the harms of SRS being forced on children, the dangers of AGP in women's spaces. Like the women shelters that don't allow trans identified males for the safety of women that are routinely attacked. 

They target businesses designed for women. They lobby to have them lose their credentials. They commit to cyberstalking and releasing private information about women that speak openly about gender critical views."
841,DistantGlimmer,"Yes, that's all true and it's allready terrible but I have seen other posts where they are actually seriously planning terrorist attacks against women and then you see the psychopathic rage they display online in things like this. I'm just really scared things are going to escalate before it gets taken seriously. A lot of these transactivists belong in jail and if they were any other group probably would be."
842,gendercritics,... Very mature response he gave you !
843,derpyskates,I am in awe of this exchange
844,lisasimpsonfan,You worded that perfectly about why we need feminism and how it's about women not putting men first.  I really hope you reported that person.  Such an aggressive response isn't OK.
845,crispycherrypie,">discriminating against men is unfeminist 

Ah, yes. That totally real thing, systematic oppression of men for being male."
846,ciaokhan,"I tried to balance you out, friend. 

What's funny to me, is even in the way they type and address you..I could call them out for being men. 

So aggressive and apt on pushing you down.

Try not to let is dishearten you. The movement is now being viewed in public, and quite frankly they don't look so good. Incels needed publicity to be addressed as a threat, this situation is no different."
847,griffxx,"You know they Reddit is cracking down on the users who says these exact phases. They are getting there accounts suspended for a few days.

You should report the whole Sub."
848,Shv3ya,"Most men, mo matter what they’re wearing, think that reeeeing at us to just stfu will work in their favor whenever they have no response to a valid point we’ve made.  These guys are just extreme MRAs."
849,doktorjackofthemoon,"It ain't about equality, it's about EQUITY!!! 

There will always be things that women need that do not affect men, and vice versa... And, when you get down to it, those things almost always boil down to *biological* differences."
850,PrayandThrowaway,">catering to their oppressors

Holy shit good fucking point I never really caught that and now I’m pissed. I definitely have bent too much for others."
851,TubularFem,"I’m so amazed how valiantly men on Reddit will defend women.. only if they’re trans women. Regular women and trans men are not oppressed, though, and can fuck right off."
852,c1ar3,"If being a ""terf"" means I appreciate irony, well, hell yeah!"
853,,[removed]
854,,[removed]
855,nibadeyy,"Oh i think i understood it wrong. I think feminism is about equality for females. I dont think feminists have to hate men or have to have more rights than men. Just equality. That what i understood from the comment.
Tho i must say people shouldn't insult you thats just stupid. Insults are always bad and useless"
856,myousername,By all means go ahead and check out my comment history if you're the masochistic type 🙄
857,myousername,"Yeah honestly these people are far too dense and self centered for me to let it get me down 😂

Thanks for balancing me out, friend."
858,sojourner_truth_,Are they? Because I was called that and instantly banned from a sub just a few days ago. At this point it feels like most subs are moderated by trans rights activists who will immediately ban anyone who has ever disagreed with their agenda.
859,,LMAO. you ARE the patriarchy
860,myousername,It is almost always used in a context where the goal is to silence and degrade women. This is a prime example.
861,hedaleksa,"My god I wish I hadn’t lol you interact with a lot of angry men who think if they tantrum enough it’ll make them a lady. This shit will crumble as quickly as it came it’s a matter of time.  

Bonus points for the dude that said being a woman and being biologically female are different things. They need the validation and buy-in of society to be “valid” where no matter what we just are. They wouldn’t do this if they weren’t living in a western country. Something tells me trans women don’t exist in places where girls and women are sold and traded like chattel."
862,ciaokhan,"It's narcissists 101. You fight the good fight, which I respect. But sadly its fruitless. People in their position will never stop demanding, if we keep standing our ground. In the end we'll only be held accountable for being resilient, not a cluster of violent and aggressive men who identify as women."
863,winewatcher,"I’ve been permanently banned from several subs and I’ve only been here for a couple of months. The other day I posted a commented empathizing with a woman female or trans I don’t know) who said she had been sexually assaulted and wanted to know if others thought she should report the friend who attacked her. Others said to report her rapist. I was empathic and also said that if she didn’t report him he would go on to rape other women. I finished with something like “Think of your sisters”. 

Some trans person must have looked at my profile or recognized my Reddit name and screamed at me online about having no right to comment, I was a pretend feminist, etc. 

Unfuckingbelievable!  Nothing I said was particularly feminist. It was just one woman empathasizing with the suffering of another woman at the hands of a man who attacked her. One human being reaching out to comfort another. 

The person who reacted so badly to not being centered in that moment was a man larping as a woman and doing it badly because he failed Female Bonding 101. 

He’s a man because his rage at me was so disproportionate to my comment and to the tone of the comment (empathy and sisterly advice which the woman asked for). 

He’s a man because he immediately jumped to who owns feminism when that wasn’t the topic. 

He’s a man because if it isn’t about him he can’t be quiet or move along. 

He’s a man because maybe the topic of sexual assault, rape, and friends who are attackers hit to close to home so he had to derail the thread."
864,griffxx,Part of the new Reddit rules of Enlightenment. Super Meta Trans Mod Barfin was suspended for 2 days.
865,,[removed]
866,winewatcher,"I’ve read that in some Muslim countries certain families prefer that their gay and lesbian offspring become trans (surgery/hormones, too) rather than have same-sex relationships with partners. I’m sorry I didn’t save whatever I read on this."
867,myousername,"Yeah, it's almost comical that a bunch of men in dresses and party city wigs think they get to define feminism. TRAs say I'm not a ""real feminist"" because I don't include ""all women"" (aka trans women). It feels exactly like mansplaining. They are basically misgendering themselves."
868,luckyme1315,"I’ve been permanently banned and called a terf from several subs where I never posted, just because I participate here. I don’t give a shit, I’m not going anywhere. I’m too old to be intimidated by a bunch of narcissistic men dressed up as anime characters."
869,sojourner_truth_,Damn. What is the world coming to when showing basic empathy provokes such a hateful response? I guess the TIMs know that any kind of sisterly bonding is a threat to his control.
870,2or3thingsIknow,2 whole days! However will he deal?
871,myousername,Your contempt and lack of empathy for women outs you as male. You will never be female.
872,CorporalWotjek,Confirmed by the mosques I visited. It’s even the plot point of a lesbian book.
873,winewatcher,Party City! 🤣 ROFL! You must be in America. Those are the worst one-use wigs available!
874,winewatcher,"I took the banning to be a compliment, particularly the “pretend feminist” “slur” (given that I was marching in the streets back in the mid-1970s and active in both feminist and gay/lesbian rights organizations before either these TRAs or maybe even their parents were born)."
875,griffxx,"Correction: Bardfinn Yeah, but he's been here since Reddit began. So it's sort of a big deal. Also the co-conspirator with MollyMollyKelKel and the ""GC brigaded AL"" lie."
876,notkeenonmen,do you know the artist who made this? I really like their style and I wanna see if they’ve done more gen crit work :~)
877,heavenlycaterpiller,They literally kill TERFs. See Dana Carvey. TERFs do not kill trans.
878,mothprincess,@red.katherinee on instagram :]
879,sturmfeuer939393,"You mean Dana Rivers.

https://www.gendertrending.com/2019/08/13/media-blackout-on-dana-rivers-michfest-murder-trial/"
880,MothlyOne,Looked it up and I see zero news. Can you provide a link?
881,,[removed]
882,Shrimpy_monsters,"I posted a link to some really violent art made about her. I don’t know if the moderator will allow the link but you can google her name with transphobic and see it. Warning, disturbing"
883,heavenlycaterpiller,Yes thank you. Carvey is a comedian my bad.
884,BigYoghurt,Dana rivers for one. Have you not seen the death threats on this subreddit?
885,AutoModerator,"Welcome to r/terfisaslur. 

What is a ""TERF""? While ""TERF"" is supposed to stand for ""Trans Exclusionary Radical Feminist,"" the people called ""TERF"" generally are neither radical feminists nor ""trans exclusionary,"" and in practice the term has become a slur. [More info.](https://redd.it/70cyzm)

We're documenting hateful rhetoric directed at lesbians, radical feminists, gender critical feminists, and others on Reddit and beyond.

If you're curious about why certain trans activists are clashing with some feminists, see [these resources](https://www.reddit.com/r/GenderCritical/wiki/resources#wiki_great_resources_for_people_new_to_gender_critical_feminism) from r/GenderCritical.


*I am a bot, and this action was performed automatically. Please [contact the moderators of this subreddit](/message/compose/?to=/r/terfisaslur) if you have any questions or concerns.*"
886,2or3thingsIknow,We should be scared. mentally unhinged lunatics who threaten rape and death? Yeah. Stay far away from them.
887,xx_power,"How do you do fellow women? As a womanly woman I routinely wish rape upon other womanly women. Just women things, teehee"
888,AngelaMotorman,Please tell us you reported that to the admins.
889,ThisIsLifeJim,Us feminists are an aggressive bunch......oh wait.....
890,Shv3ya,"
It’s not a mental illness though 🙄"
891,smh_cheeze,"this is ultra fucked up, but sit on your white horse!!!"
892,quasarbar,Rape is a hate crime but not legally recognized as a hate crime.
893,LonelyLonerLez,"How awful! This really scares me too... I hope they were banned, but if course they'll be back..."
894,meow_thug,Wow much progress!
895,yaxxy,"The karma for not wanting to get raped is having a family member raped??

Uhuh"
896,,[deleted]
897,dusknoirsbigredeye,Don't all women threaten rape to each other???? /s
898,dusknoirsbigredeye,Stahp my girldick couldn't get more erect!!
899,dusknoirsbigredeye,I honestly didn't even think to. I will go do that now since they left this same comment multiple times to different people.
900,dusknoirsbigredeye,So where is the sub that documents radfems/GC people spewing actual transphobia??? They love to claim that we are actually the aggressors but I've yet to see any proof.
901,dusknoirsbigredeye,Are you talking about me or the guy I screenshotted?
902,,Just gorl  things 😸
903,,I haven't been! Jeez. Maybe I'm really a man?
904,xx_power,You know it's a real woman talking when they threaten corrective rape with their girl dick
905,Blue_Train,I thought that dude was the admin of the sub.
906,AngelaMotorman,"There's a link at the bottom of every page on Reddit labeled ""contact us"". That will lead to a page where you can submit a link. You don't get much chance to explain anything, but in this case I don't think you need to explain anything."
907,FrettyLounds,"Could you DM me this subreddit? I would love to check out their sad ""proof"""
908,emilialillienne,\**happy rapist noises*\* uwu
909,crispycherrypie,"She means report it to the Reddit admins, not the mods of the sub."
910,dusknoirsbigredeye,I would love to see it also but I don't think it exists. The only kind of proof I have seen them try and use is from alt-right transphobic people. They really love to claim that all violence towards them is from GC/Radfems.
911,AutoModerator,"Welcome to r/terfisaslur. 

What is a ""TERF""? While ""TERF"" is supposed to stand for ""Trans Exclusionary Radical Feminist,"" the people called ""TERF"" generally are neither radical feminists nor ""trans exclusionary,"" and in practice the term has become a slur. [More info.](https://redd.it/70cyzm)

We're documenting hateful rhetoric directed at lesbians, radical feminists, gender critical feminists, and others on Reddit and beyond.

If you're curious about why certain trans activists are clashing with some feminists, see [these resources](https://www.reddit.com/r/GenderCritical/wiki/resources#wiki_great_resources_for_people_new_to_gender_critical_feminism) from r/GenderCritical.


*I am a bot, and this action was performed automatically. Please [contact the moderators of this subreddit](/message/compose/?to=/r/terfisaslur) if you have any questions or concerns.*"
912,moonflower,Well he's right - there is no place in the modern feminist movement for female people who don't submit to the male people who are now in charge of it
913,Revstokely,The liberal feminist ideal: A white male.
914,PsychicCaramelle,The fucking nerve of these stupid men.
915,,Imagine knowing this guy irl. Insufferable.
916,Terf_Force_One,"Whoes a good little ""male feminist"" with pronouns in his name? 

Who do they think they are lecturing to women what feminism should be?"
917,BoobDoodles,"Men can’t be feminists. They can support feminists, be an ally to feminists (preferably by leading by example in treating women with respect, being anti rape, etc), but the struggle is ours alone."
918,,"Who handed out all the Women club cards to men? Where can I find the woman that okay’d   males to  dictate feminism?
What  happen to this movement?  Why do  these males  think this is remotely acceptable? 
All was good when I left activism  in 2012, back when everyone knew what a woman was  and we had men starting to  try to be decent people ... but look where we are now? 
Men such as these should be receiving a verbal smackdown to remind them of their place before Our foremothers roll out of their graves in contempt for whatever this is going on because this male is not a feminist. 
Also:They call us trans exclusionary but fail to realize we aren’t excluding trans men (AFABs), we exclude males and  the LadyDique owners  because males have no place in feminism outside of  standing in solidarity with us and being allys.
Enemy of thy enemies are not friends
Edit: To the kind strange who gave me a gold award many thanks be upon you. May the universe treat you favourably"
919,,"Haha, look at this this sad, irrelevant little chode. He'll get his... and that ""AS A MALE"". Like we couldn't spot your scrawny ass a mile off?

For those in the back: MEN CANNOT BE FEMINISTS. EVER, EVER, EVER."
920,BoobDoodles,I see what you did there.
921,MaxinistaFemmeinista,Definitely a *checks notes* white male.
922,fulloftrivia,"I know 0, I think they put so much time on the net on  they make it seem common. 

I know a dude personally that started and runs well over 300 subreddits (not much gender related stuff).

He's an oddball with a big internet presence, but is a weak poor man IRL. He also operates on other websites, he has no life outside of his preaching and online activism.

MtF dudes vs women in sports doesn't fly in any of Reddit's regular sports related subs, you can see that. Unlike a lot of Reddit subs, they're not modded by propagandists censoring away dissent."
923,EgregiousWeasel,"It's because women started trying to placate men by saying that feminism can help them too, by discouraging the enforcement of gender stereotypes. Then men started saying they were feminist allies, and women cheered them on, thinking, ""Finally, some of them get it and care about us!"" That led to men calling themselves feminists, and women included them because that's how we're socialized. And now, in traditional male fashion, they have taken over and think they're doing it better."
924,terf_fret,"I know two men like this. 

Edit: Wait, at least four. 

Edit: five."
925,,"You don’t say! Men? Taking something over and claiming ownership of it? 
Well, I never thought the adult human males would be capable of such things.Its not like feminism was formed because men have been doing that for centuries. 
I am just shocked. Shocked! I tell you h’wat"
926,,😂😂😂
927,AutoModerator,"Welcome to r/terfisaslur. 

What is a ""TERF""? While ""TERF"" is supposed to stand for ""Trans Exclusionary Radical Feminist,"" the people called ""TERF"" generally are neither radical feminists nor ""trans exclusionary,"" and in practice the term has become a slur. [More info.](https://redd.it/70cyzm)

We're documenting hateful rhetoric directed at lesbians, radical feminists, gender critical feminists, and others on Reddit and beyond.

If you're curious about why certain trans activists are clashing with some feminists, see [these resources](https://www.reddit.com/r/GenderCritical/wiki/resources#wiki_great_resources_for_people_new_to_gender_critical_feminism) from r/GenderCritical.


*I am a bot, and this action was performed automatically. Please [contact the moderators of this subreddit](/message/compose/?to=/r/terfisaslur) if you have any questions or concerns.*"
928,BigYoghurt,I commented that people with penises in lesbian spaces are colonizing. The amount of sexual threats I got were appalling
929,Tangleofsnakes,"""When people recognize us as male they're literally denying our existence!! So let me make explicit implications that I want women to die."""
930,Loopylafae,"I got tossed from ask feminists for calling myself a woman's liberationist ...because describing myself accurately is ""terfy"" ffs..."
931,Lady_Montgomery,"transbians\_irl it has become. It was getting worse and worse lately. Ever since the drama with r/actualtransbians I mean lesbians. That last post about men being women, belonging in lesbian spaces, just sealed the deal for me. That sub has completely been taken over as well. Another sub where women are being excluded."
932,AsthmaticWolf,Ffs... it’s like we’re in a rejected Black Mirror episode
933,baconbitsy,Turn them in to reddit for this.  They’re ACTIVELY promoting suicide.
934,mypretties,"“MEN IN SKIRTS ARE NOT A DANGER TO WOMEN!!! ALSO, CHOKE ON MY GIRLDICK AND DIE TERF!”"
935,jericho626,Can’t you report the sub to reddit directly? Or the mods? I thought that ‘terf’ was considered hate speech now....
936,angrytardis,"Please report this to reddit admin. It might not make a difference, each individual one but it will eventually."
937,sensicalsense,I went ahead and commented too. I'll be banned I'm sure but I'm so so tired. Looks like your comment got some awards even though it's removed now
938,hedaleksa,"misogyny level 100000: being a man who thinks under any circumstance he can police women

He thinks his male fantasy of being a woman gives him a right to talk over women 

This is exactly like white people thinking reverse racism is a thing"
939,TrainingBluejay,That is exactly what you'd expect a woman who loves women to say to another woman.
940,shrek_in_me_butt,Ur comeback
941,ESyzygy,“Hi fellow lesbian! You are banned from our lesbian community because you are lesbain!”
942,OddOneinTheHouse,That comeback lmao
943,fanslo,I wouldn't consider that violence
944,hedaleksa,"Men behave like men no matter how much they whine that they’re women 

You can give a man materialistic stereotypes but you can’t take away his hatred of real women"
945,dedicatedgc,TIMs really love their rape threats.
946,BigYoghurt,IKR? Its disgusting. Its also funny how all of their threats are explicitly male
947,LilianH,"Projection, everything they say we believe/do is always what they themselves believe/do. Every single time."
948,gettheloutasia,"We have a running joke, ""everything is transphobic"", as long as they experience any kind of discomfort, it's someone else's problem, that's basically how abusers think, that people must revolve around them or there's something wrong with the other person."
949,BigYoghurt,"Seriously. Other than truelesbians, there doesn't seem to be any lesbian spaces left"
950,runtis,"Same with latebloomerlesbians. I thought it was a support sub for women realising later in life that they are gay and a lot of posts are about leaving husbands and children to start a new authentic life.

But Terfs (i.e people that believe a lesbian is an adult human female) aren't welcome because transwomen are women. Transwomen are men, so WTF is the point of that sub?

Unsubscribed."
951,BigYoghurt,Where would I go to report this?
952,BigYoghurt,You can? Well it's the mods that sent me this
953,BigYoghurt,Yeah it was weird. I don't know why I got awarded. Hey we're ban buddies!
954,Lady_Montgomery,"Have encountered a TRA or 2 there too. Women who are lesbians and wouldn't ever in their right mind date a tim, cause you know they are lesbians and wouldn't date a guy, but still acknowledge them as women, and claimed I was a terf and a meanie for not seeing these poor poor babies for what they truly are, women just like you and I. :( 

But usually its just lesgals amongst each other. Yeah. Miracle that sub hasn't been reported yet and closed down, for not being inclusive."
955,baconbitsy,I usually just google “report to reddit admin” because I have trouble remembering.  Then I follow the steps.
956,jericho626,I meant report the mods. Sorry if that didn’t come across clearly.
957,angrytardis,Yes you can.
958,sensicalsense,"It's absolutely wild but while I've been downvoted to hell I have yet to be banned. I do think we should make an ""arguing with tra"" bingo board. Have things like ""die t*rf"" ""fuck off bigot"" ""intersex exists so sex is a spectrum"" ""woman is the set of people that are women"" ""no one is trying to make you fuck a trans person"" ""we wouldn't want to fuck you anyways"" etc. Could be fun!"
959,BigYoghurt,Gross. TRAs need to admit they're bisexual and leave lesbian spaces alone. Wow I hope it doesn't get shut down
960,BigYoghurt,Oh cool thanks. I'll look into it
961,BigYoghurt,Ooooh that would be fun! You could fill up the whole board with that thread alone
962,Lady_Montgomery,"They ain't bisexual, that's why they would never date a tim, because a tim isn't a woman. Yet they claim to see tims as women and that they deserve to enter women's spaces, but don't want to have anything to do with them. Mindboggling."
963,baconbitsy,"Sorry!  Wish I had it in my brain right now, but I’m at the dr"
964,BigYoghurt,"Yeah, you're right. I hadn't considered that they're just virtue signalling"
965,Lady_Montgomery,Gotta love the handmaidens.
