,Comment Author,Comment Body
0,2or3thingsIknow,They simply do not care. Because of all the social capital they have they are literally acting like terrorists and slamming women all over the place.
1,baconbitsy,"Honey, the amount of people who use “TERF” to stop a discussion is ridiculous.  “I’m not gonna debate you because you’re a TERF!” followed by a lot of nonsensical insults just proves what they really are: misogynists."
2,Vibrosphere,You're invalidating the women who menstruate by sticking tomato juice Popsicles in their recta and collecting the meltjuice with tampons and menstrual pads.
3,Simone_Auclert,If you're woman who acknowledges reality you're a terf.
4,,[removed]
5,Cha-Challenger,First off all they're not saying MtFs can have periods. They're saying FtMs can still have periods post transition.
6,mypretties,"They have a ton of time of their hands since 99% of society wants nothing to do with them.

TIMs: “I can be a normal man and go out and achieve a good life for myself or I can sit in my mom’s basement, shriek TERF at her if she questions me stealing my sister’s panties, eat cheetos, stick tomato juice up my ass and mod r/actuallesbians. Hmmm gonna have to go with choice #2!”"
7,stargazer612,Oh dear gawd is this a thing????
8,TheCatsEyeNebula,A few months and they'll use this as an arguement.
9,BellejarredDylan,But testosterone stops periods. So Ftm shouldn't be having them
10,Vibrosphere,"You know I want to go shake my finger at the youth and yell at them to GTFO my lawn but a lot of the most egregious TIMs are men older than myself (41)

Like, bro, you should know better."
11,ESyzygy,I’m ok with r/actuallesbians but only because I only pay attention to the cutesy romantic posts and not the trans/“girldick” ones
12,Vibrosphere,Well documented.
13,Idkjustgotquestions,Depends for some it takes a while for it to take effect and some aren’t on hormone replacement yet.
14,insomniac29,I know an FTM that sometimes gets periods for missing hormone doses. A lot of trans people don’t have regular access to treatment. They’re saving up for a hysterectomy. Or technically someone who hasn’t started treatment yet or for some reason doesn’t want medical treatment could identify as trans.
15,stargazer612,Just researched and will now scrub my browser history. Omg
16,BellejarredDylan,Im still going to only say women have periods
17,insomniac29,"Okay that’s fine, I’m just responding to your post saying that an FTM can’t have a period, they sometimes do."
18,AutoModerator,"Welcome to r/terfisaslur. 

What is a ""TERF""? While ""TERF"" is supposed to stand for ""Trans Exclusionary Radical Feminist,"" the people called ""TERF"" generally are neither radical feminists nor ""trans exclusionary,"" and in practice the term has become a slur. [More info.](https://redd.it/70cyzm)

We're documenting hateful rhetoric directed at lesbians, radical feminists, gender critical feminists, and others on Reddit and beyond.

If you're curious about why certain trans activists are clashing with some feminists, see [these resources](https://www.reddit.com/r/GenderCritical/wiki/resources#wiki_great_resources_for_people_new_to_gender_critical_feminism) from r/GenderCritical.


*I am a bot, and this action was performed automatically. Please [contact the moderators of this subreddit](/message/compose/?to=/r/terfisaslur) if you have any questions or concerns.*"
19,GenderIsntCritical,"They can change their hair or what they wear, but no matter what they do, a man is still a man"
20,WikiMB,That explains how much violent the response for any skepticism regarding transgenderism is. And because of it I either hide or use my alt account to rise my voice on topics like these.
21,Tulcey-Lee,"I had an account locked yesterday on twitter. Unable to have a discussion with said person as they resorted to calling me a bitch and a terf and then the rape threats started. How is it now we live in a world where you can’t disagree anymore? Your opinion means you are fine to be harassed and threatened. 
I stated biology and that women don’t have a penis and there was no coherent argument just abuse."
22,Killy00013,Am I misreading this? It sounds like she doesn't belive both sides behave badly calling it a fallacy and also seems to support jk rowling by saying that those who send her death and rape threats arent women
23,maat89,And I opp....
24,Cha-Challenger,What did you do to cause this? Can you link the thread?
25,qsims,She doesn’t she’s pointing out how bullshit the claim is
26,Tulcey-Lee,"They said some
Women have penis’s and I said no they don’t."
27,Killy00013,"she forgot to put /s then, I hate when people are sarcastic online, I usually cant tell because nowdays you can say the most fcked up things and actually mean them"
28,qsims,But she’s not being sarcastic..?
29,Killy00013,"if she isnt sarcastic then she sounds like she is on jk's side, that's how i see it"
30,qsims,I’m sorry I don’t understand how?
31,AutoModerator,"Welcome to r/terfisaslur. 

What is a ""TERF""? While ""TERF"" is supposed to stand for ""Trans Exclusionary Radical Feminist,"" the people called ""TERF"" generally are neither radical feminists nor ""trans exclusionary,"" and in practice the term has become a slur. [More info.](https://redd.it/70cyzm)

We're documenting hateful rhetoric directed at lesbians, radical feminists, gender critical feminists, and others on Reddit and beyond.

If you're curious about why certain trans activists are clashing with some feminists, see [these resources](https://www.reddit.com/r/GenderCritical/wiki/resources#wiki_great_resources_for_people_new_to_gender_critical_feminism) from r/GenderCritical.


*I am a bot, and this action was performed automatically. Please [contact the moderators of this subreddit](/message/compose/?to=/r/terfisaslur) if you have any questions or concerns.*"
32,,Had some male say they wanted to cannibalize my uterus for running radfem sapphic page before so this checks out
33,mypretties,Most TIMs are violent misogynists
34,YesPleaseMadam,"Online: I will perform female genital mutilation on you ugly TERF 

IRL: Has a menial remote job, orders everything he needs on the internet, hasn’t talked to a woman in 9 years other than his grandma that he calls on birthdays, never had sex, probably not even out as TIM yet mostly because he doesn’t have anyone to out* himself to

*edit: typo"
35,Skaddox,Who would have thought their mental illness also seeps into every other aspect of their life and personality??
36,yesisaiditxx,"Man, isn’t the internet a wild ride. You read something like this and think it’s a toss up between, “This man would maybe actually violently attack me and hurt me if we ever had a real life confrontation” *or* “One dose of my ability to speak my mind critically and bluntly in real life and I’d make this dude cry.”"
37,Think__Critically,But misgendering is *literal violence*. This is fine though.
38,BettysBitterButter,He can't help it.  He's so oppressed.  You wouldn't understand.
39,babylonsisters,"I cant wait for the day I can respond to shit like this with, ""Sounds like some internalized misogyny."" because it reminds them that they cant escape the fact that their behavior reflects a male pathology."
40,faultierin,"Well, thats not very ladylike"
41,,So violently jealous of our bodies he's murderous.
42,stegosaurid,Totally not an incel though...
43,Glamalez,"I’d like to see him try, I sleep with a gun😉"
44,IndustrialDinge,I wonder if he typed this up during his breaks at the help desk
45,willyounicelyfuckoff,This is a mental illness
46,griffxx,"But they are a woman, this can't be the case, cause if was that would make them a 
MAN/s..."
47,Blondejobs,Man wants to beat and disfigure women because they won’t “shut up ” sounds about right.
48,06549r,Isn’t that the stupid kid who then pulled the “I’m just a kid” when everyone was tearing him a new one for saying all that shit?
49,throwpatatasmyway,Yet they insist that TERFs (mostly lesbians who just won't suck that D) are the violent ones. Lmfao. What a bunch of wackos.
50,crikeyuhoh,"Ok, Ed Gein."
51,Randomosaur,"Is that even possible? If you put your hand far enough inside you'd be inside the uterus, unable to grab it or rip it out."
52,AKinglyAss,feel the progressiveness...
53,forvalentinesday2020,They always focus on the 'female' part of us. Like it's so obvious that they hate us for being women.
54,ArtGal94,"literally made me physically recoil. 

if this isn't LiTeRaL ViOlEnCE I don't know what is"
55,Imnotfashionimawoman,"This is disgusting , I'm gonna need to stay away from males for a bit"
56,tamingthemind,Points for creativity? /s
57,6nig6nog6,He's trying to consume your female essence
58,NineSevenFive975,That’s a rather large brush you’re painting on a group of people?
59,BettysBitterButter,He only calls his grandma on *his* birthday.  Certainly not hers.
60,ReignRain95,"lol thats a cope, these could very well be people that look normal to everyone else irl."
61,daughter_of_bilitis,">“One dose of my ability to speak my mind critically and bluntly in real life and I’d make this dude cry.”

Not that hard, just use the correct pronouns for him 😂"
62,tamingthemind,"He's just expressing himself, jeeeeeez /s"
63,NineSevenFive975,Transgendered people are pretty oppressed now they can’t even serve in the US army boo.
64,throwpatatasmyway,Very Bufallo Bill like.
65,EffectiveProcess,Same.
66,NineSevenFive975,What being trans?
67,DimDroog,"Who?

I don't remember this."
68,YesPleaseMadam,hahaha. yeah that’s better.
69,AKinglyAss,"""I noticed that there was no cheque in my birthday card this year, grandma. I'm *sure* this was a mistake..."""
70,atomiic_vomiit,awwwww they can’t serve in the rape machine that is the us military? tragic. judging by this post the XYs would fit right it.
71,willyounicelyfuckoff,"I am talking about the obvious, threatening to commit a crime when someone doesn't agree with your opinion."
72,blackjackist,Lmfao
73,girl_undone,Locked because this is still getting brigaded a month later.
74,fedram,"👏👏👏👏👏

This should be on r/GenderCritical as well."
75,gcrit,"[source](https://fairplayforwomen.com/letter-woman-called-terf/) 

i love the words and the message but you should credit the author"
76,all_the_people_sleep,Great post.
77,auklet,This is brilliant.
78,magdaal,"Hey I agree with everyone saying this is a great post, but the decent thing to do would be to link to the source, or at least add a disclaimer that you’re not the author :-)"
79,erin93,This is beautifully written. Thank you for sharing!
80,QueenRowana,Oh and welcome to our guests from the GenderCynical sub who love me so much for standing up for women and who absolutely adore how i want nothing to do with their genderconfused angershouts.
81,beccagrubb,"Great post, thanks for sharing."
82,sailornptn,Bless you a thousand times. People like you made me feel like I wasn’t crazy for thinking this way.
83,,[removed]
84,,[removed]
85,,[removed]
86,,[removed]
87,,[removed]
88,,[removed]
89,arrivingufo,Came here to second this!
90,LivingandDyinginLA,I came here to say the exact same thing.
91,,[removed]
92,LolliesDontPop,Plaaaaaaaaagiarism
93,sarahkate2011,Karma whoring at its finest.
94,QueenRowana,"What we want if for men to stay out of womens spaces. Simple. Fighting for women is a good thing. If that means some men get their little girl panties (that they love wearing so much) in a twist. I ain’t upset. And if they want to use slurs and threaten us while doing it. Well thats hurtful but still inconsequential. Because that report button isn’t just decorative.  I’m standing up for women so men, yeah i dont care if you chop off your dick or wear a dress and makeup.  They’re never gonna be a woman. 
Have a lovely day!"
95,QueenRowana,"I love that this is still pissing men off almost a month later. Men who, by the way, are not and never will be women. Sorry you have no life. Big F (whatever that means)"
96,QueenRowana,I don’t think i understand what you mean?
97,QueenRowana,"Right so how much of that post did you read and how long have the Tims been whispering in your ear? 

Women’s spaces should be for women and women only. These weirdos in wigs and dresses are not and can never be women. No matter how badly they mutilate their genitals. I will not bow down to their behavior and i will not accept insults from “allies” like you.  You contribute to a system that demeans women and denies us our existence. A system that doesn’t even allow lesbian her sexuality anymore. A system where a male mediocre weightlifter can decide today that he is a woman and start winning gold medals in women’s classifications tomorrow. 

Terf is a foul slur usually accompanied by threats of beatings, rapes and murder to women who refuse to cater to men’s fragile ego’s and most notably their autogynephila and fetishes. 
I refuse to be called names by woke weirdos like you who think women should die when all we want is to make men get out of our faces, out of our sports and out of out bathrooms. We dont want them to die, we want them to act like a normal human being. Not a anime doll. But you just echo what they teach you. 

Next time you call someone trash please re-read this message and realize i could have just insulted you right back. But i didnt do that. Now try and see who is the one between us two capable of calm and rational thought and who has used cursewords as their only retort to a woman standing up for herself."
98,QueenRowana,"They’re men. The text says nothing about qualification. I wouldnt want to be treated by an unqualfied woman either. But i dint want to be cared for by a man perion.  These are men, not “trans women!?!!” And yes they are attempting to steal women only spaces. They are men. It’s their ultimate goal it seems."
99,QueenRowana,Correct i didn’t write it. But i had not seen it on this sub before and loved it. I agree with it completely. Men can get the hell out if womens spaces. They are not welcome. And diaper fetishists too by the way sir!
100,auklet,"Terf is used as a slur, by trans rights activists. You'll often hear it in phrases such as ""kill all terfs.""  I think many ""terfs"" agree that ""terf""  is an accurate term when used to mean ""woman who doesn't agree that a man can become a woman."" But trans activists use it to mean, ""Person who refuses to validate my claim to be a woman and therefore should be humiliated, ostracized, and murdered. """
101,girl_undone,Why don't you read the information stickied to the top of this subreddit instead of acting like an asshole?
102,,[removed]
103,,[removed]
104,,[removed]
105,,[removed]
106,kaladinner,"Gotcha, thanks. Are the majority of you also sex-worker exclusionary as well? If you remove delusions of infinite genders, and hedonistic pornographer women being glorified, then I can get behind feminism. I mean, I'm still gonna call obese, dyed haired women ""SJWs""; and I'm sure as hell not denying that men are biologically stronger than women, but other non-sexually-immoral ideologies you guys hold are fine by me."
107,QueenRowana,"I’m not against normal men who mind their own business at all. Men can be great. I’m only against trans people if they are men trying to get away with stuff and get into female spaces by wearing dresses and turning their penis inside out or even just claiming they are women while they arent even remotely trying, they are literally just men. I have little to no trouble with women who try to become men. They don’t bother me usually. I say good luck to them. They are still weird but I wish them luck fitting in with men. But men trying to be women. Yeah i have something against them and i will fight against them and for women.  

Every day. 

Again. Have a nice day."
108,QueenRowana,"I didnt write it. I do agree with it though. 

I never said YOU were a man. I just said ‘men’ but if you felt like i was talking about you go off i guess. 

And are you sure you’re a woman. Isn’t that enforcing a gender binary which could hurt trans peoples feelings? (Big sarcasm in case you didn’t get that)"
109,QueenRowana,"I am indeed not bothered at all by that. Because i care about women and preserving our spaces, not about the fragile ego’s of men who like to wear dresses and want to be called “ma’am”"
110,QueenRowana,That dont mean it’s untrue though. Men with a trans fetish are a danger to women. Whether i wrote it or not doesnt make it false.
111,auklet,"Radical feminists,  ftom what I read, see ""sex work"" including porn as exploitative."
112,girl_undone,"It's a misnomer to say feminists are ""excluding"" ""sex workers"" when we say that the men who rape and sell women in sexual slavery and prostitution are horrible and shouldn't be able to do that."
113,,[removed]
114,,[removed]
115,kaladinner,Can you elaborate?
116,QueenRowana,"Trans ‘women’ are men. The reason they don’t pass is because they are men. Not women. 

> . Men don’t try to get into female spaces by being trans. 

Lol. It’s 50% “grr i’m not allowed in womens [fill in here: bathroom, locker room, rape shelter, prison] Let’s put on a dress and waltz in, no one will dare stop me”. These are predators out to get weak women and many cases are documented of  so called “trans women” (men) getting permission to go to female prision instead of male and at the very least creeping the fuck out of vulnerable women and at worst rape and hurt them. Many cases about men freaking out for not being admitted to women rape shelters. Cases of men sendingvdeath threats to lesbians who refuse to fuck men with dicks. Of pedophiles who claim to be trans to get lowered sentences. Of men going Into womens bathrooms with ugly dresses and terrible fake wigs just for fun and to terrify women in a space where once they would have come to get away from men. 

And 50% “ i just want to have tits to play with and be submissive slut in bed”. Of which the last one i will admit are usually not quite as nefarious. But they’re definitely AGP."
117,QueenRowana,"Fetish? Lol i have literally 0 fetishes.  Your “tendencies” are a fetish. 
I care about women enough to not want men with dicks forcing themselves into lesbian spaces, into women rape shelters, into womens locker rooms, toilets and prisons.  If your main objective is forcing women to just lie down and take it while men like you walk all over them you are not a feminist."
118,,[removed]
119,QueenRowana,"Fascination with “lady dick”? I have never used that word except to express my disgust at the word. Maybe you mistook my disgusted frustration at men referring to penises as a “girldick” for fascination, HalfBreed?

Men like you saying stuff like ‘kill terfs’ are inciting violence against women yet somehow i’m the one who doesnt care about women? Thats cute dude! Such a male thing to do!
Hope you have a great day!"
120,,[removed]
121,QueenRowana,"Frustration at Lack of having a maledick. Lol. No thanks. Dick can be nice, but not on me, only in me. 

You dont have a ‘girldick’ if such a thing even exists. You just have a dick. You’re a man.. simple. 

Three legs??? Your dick being leg three then. Yes. Sounds accurate..."
122,AutoModerator,"Welcome to r/terfisaslur. 

What is a ""TERF""? While ""TERF"" is supposed to stand for ""Trans Exclusionary Radical Feminist,"" the people called ""TERF"" generally are neither radical feminists nor ""trans exclusionary,"" and in practice the term has become a slur. [More info.](https://redd.it/70cyzm)

We're documenting hateful rhetoric directed at lesbians, radical feminists, gender critical feminists, and others on Reddit and beyond.

If you're curious about why certain trans activists are clashing with some feminists, see [these resources](https://www.reddit.com/r/GenderCritical/wiki/resources#wiki_great_resources_for_people_new_to_gender_critical_feminism) from r/GenderCritical.


*I am a bot, and this action was performed automatically. Please [contact the moderators of this subreddit](/message/compose/?to=/r/terfisaslur) if you have any questions or concerns.*"
123,,[deleted]
124,QueenRowana,"Ah yes rape threats. So common for men. 

50% of them are violent predators
The other 50 is just sexual fetishists. 

Both of these types have one thing in common: hatred for women who refuse to validate dicks. Whether they express it by creeping out and even hurting women or by yelling at us through the interwebs matters not. The hatred is there."
125,CallaAETHIOPICA,TIMs are rapists. No surprise there.
126,noisyasamouse,"When's the last time you've heard a woman say that any other subset of women had value only as bodies to be fucked? I'm going to guess never. This is not the sort of language that women use to attack each other. I wouldn't even use this sort of objectifying and grossly sexual language against my worst enemy.

When's the last time (before this post) you've heard a man say that women or some specific group of women had value only as holes to fuck? I'm going to guess recently. This is 100% the kind of language insecure men use to attack women."
127,,this kind of thing makes me want to sign up for a self-defense class or get a taser
128,Tulcey-Lee,What charming people.
129,glazedhamster,Such a delicate and feminine thing to say...
130,PrayandThrowaway,">be man

>dress as chick

>identify as trans chick

>demand female pronouns 

>make distinctions between you and bio women by pointing out you have a dick with which to rape women

>get triggered you’re not being called “she/her”"
131,TheHistoryMachine,"And this is how you can tell these people never were and never could be women. Because no matter how much one woman might hate another, we generally aren't going to say things like this."
132,Shv3ya,I don't understand how social media alone could spread such a horrible mental disease.
133,AnonyMooseCanadian,"I just don’t understand how or why LibFems are tolerating this bullshit. Hell, I don’t know how or why anyone is tolerating this shit. They even justify it, HOW THO? 

They cry about pronouns/misgendering like Its a death sentence and they think comments like this aren’t a bazillion times worse than being callled their biological sex? 

Fucking gross."
134,,[deleted]
135,Tweeders55,So since no straight girls will screw him the alternate choice is to rape the lesbians who would never have screwed him to begin with since it's their fault he can't get laid. It all makes so much more sense. Time for a bowl and cocktails. I will have to look up why cocktails are gendered.
136,shymmieshymz,"Tumblr should really be monitored by FBI. Most of these psychopaths will end up raping and murdering women, if they haven’t already. Fucking hell. This makes me sick."
137,terf_fret,Hope the SPLC is tracking this as well as this sub is
138,,[removed]
139,Katerwurst,If you replace Terf with woman these people sound a lot like incels.
140,wocch,r/menkampf
141,QueenRowana,Lol that comment got deleted so quick i couldnt even respond! Nice
142,LordGayoftheSevenDic,"That’s a wild generalization. TIM here, never had the urge to rape... Anybody. Nor have I EVER raped anybody."
143,0nlyL0s3rsC3ns0r,"Get a CCW and a real firearm. 

In a lot of states attempting to rape someone is sufficient grounds legally to use deadly force."
144,LesbianPrincess-,"I think most of them don't realize how bad it is. Men are FAR more to blame than libfems for this :| We should stop putting all the blame on women for ONCE in history. Honestly, the way that people talk about libfems in these subs seems so misogynistic. A lot of people in GC are ex-libfems."
145,Callsign-Alpha,That link could have been a lot worse than what it was...
146,LesbianPrincess-,"I know. I need to take a break from this stuff for a week to be honest. It’s so draining. Just when you think you’ve seen the worst, it gets even more gruesome & disheartening..."
147,LesbianPrincess-,What’s that?
148,LesbianPrincess-,"Yeah, sure, dude. You are in denial that your community is doing this. The “IT’S MA’AM!” dude, a very public trans “woman,” even posted something on Facebook about beheading terfs. 

Male violence toward women, tale as old as time. r/thisneverhappens"
149,darkestgradient,Hence the coining of the term trancel.
150,Callsign-Alpha,“But they’re the incels not us!” - Think the members of the /CuteRoom/ discord server.
151,Sophiexc,"Very impressive, good job 👏"
152,darkestgradient,More accurate to say the echoes of rape culture into the community are rarely called out when they attack acceptable targets (re: terfs).
153,darkestgradient,"I want to do this, but I have a bad mental illness record and no good references who would believe I’m stable enough not to hurt myself with one."
154,Chillhillrill,"Southern Poverty Law Center. They're a group that tracks hate groups and helps to legally take them down. I don't know that they'd be on our side in all of this, though if I'm honest."
155,Skandi007,"Ooh, I'm stealing that one."
156,0nlyL0s3rsC3ns0r,"Good on you for recognizing that as a possible issue.

Licensing differs from state to state, but whether its a good idea for you is of course a unique question."
